No.,Paper name,Link,Authors,Year,Source,Cited,Description
0,Application and benchmarking of multi-objective evolutionary algorithms on high-dose-rate brachytherapy planning for prostate cancer treatment,https://scholar.google.com//citations?view_op=view_citation&hl=vi&user=p3vHDZYAAAAJ&citation_for_view=p3vHDZYAAAAJ:MXK_kJrjxJIC,"Ngoc Hoang Luong, Tanja Alderliesten, Arjan Bel, Yury Niatsetski, Peter AN Bosman",2017,"Swarm and Evolutionary Computation, 2017",27,"High-Dose-Rate (HDR) brachytherapy (BT) treatment planning involves determining an appropriate schedule of a radiation source moving through a patient's body such that target volumes are irradiated with the planning-aim dose as much as possible while healthy tissues (i.e., organs at risk) should not be irradiated more than certain thresholds. Such movement of a radiation source can be defined by so-called dwell times at hundreds of potential dwell positions, which must be configured to satisfy a clinical protocol of multiple different treatment criteria within a strictly-limited time frame of not more than one hour. In this article, we propose a bi-objective optimization model that intuitively encapsulates in two objectives the complicated high-dimensional multi-criteria nature of the BT treatment planning problem. The resulting Pareto-optimal fronts exhibit possible trade-offs between the coverage of target volumes and …"
1,Expanding from discrete Cartesian to permutation gene-pool optimal mixing evolutionary algorithms,https://scholar.google.com//citations?view_op=view_citation&hl=vi&user=p3vHDZYAAAAJ&citation_for_view=p3vHDZYAAAAJ:ufrVoPGSRksC,"Peter AN Bosman, Ngoc Hoang Luong, Dirk Thierens",2016,"Proceedings of the Genetic and Evolutionary Computation Conference 2016, 637-644, 2016",27,"The recently introduced Gene-pool Optimal Mixing Evolutionary Algorithm (GOMEA) family, which includes the Linkage Tree Genetic Algorithm (LTGA), has been shown to scale excellently on a variety of discrete, Cartesian-space, optimization problems. This paper shows that GOMEA can quite straightforwardly also be used to solve permutation optimization problems by employing the random keys encoding of permutations. As a test problem, we consider permutation flowshop scheduling, minimizing the total flow time on 120 different problem instances (Taillard benchmark). The performance of GOMEA is compared with the recently published generalized Mallows estimation of distribution algorithm (GM-EDA). Statistical tests show that results of GOMEA variants are almost always significantly better than results of GM-EDA. Moreover, even without using local search, the new GOMEA variants obtained the best …"
2,Multi-objective gene-pool optimal mixing evolutionary algorithms,https://scholar.google.com//citations?view_op=view_citation&hl=vi&user=p3vHDZYAAAAJ&citation_for_view=p3vHDZYAAAAJ:zYLM7Y9cAGgC,"Ngoc Hoang Luong, Han La Poutré, Peter AN Bosman",2014,"Proceedings of the 2014 Annual Conference on Genetic and Evolutionary …, 2014",26,"The recently introduced Gene-pool Optimal Mixing Evolutionary Algorithm (GOMEA), with a lean, but sufficient, linkage model and an efficient variation operator, has been shown to be a robust and efficient methodology for solving single objective (SO) optimization problems with superior performance compared to classic genetic algorithms (GAs) and estimation-of-distribution algorithms (EDAs). In this paper, we bring the strengths of GOMEAs to the multi-objective (MO) optimization realm. To this end, we modify the linkage learning procedure and the variation operator of GOMEAs to better suit the need of finding the whole Pareto-optimal front rather than a single best solution. Based on state-of-the-art studies on MOEAs, we further pinpoint and incorporate two other essential components for a scalable MO optimizer. First, the use of an elitist archive is beneficial for keeping track of non-dominated solutions when the …"
3,Multi-objective optimization techniques and applications in electric power systems,https://scholar.google.com//citations?view_op=view_citation&hl=vi&user=p3vHDZYAAAAJ&citation_for_view=p3vHDZYAAAAJ:Y0pCki6q_DkC,"MOW Grond, NH Luong, J Morren, JG Slootweg",2012,"2012 47th International Universities Power Engineering Conference (UPEC), 1-6, 2012",25,"Efficient operation and planning of power systems is important for a reliable and sustainable electricity supply. Therefore, optimization techniques have been applied to several optimization problems in power systems in order to achieve technical and economic efficiency. This paper presents an overview of existing optimization techniques and applications in power systems, with a special focus on multi-objective optimization in power system planning. Power system planning is by its nature a very complex multi-objective optimization problem involving perspectives of different stakeholders. Besides, a single stakeholder can also have various objectives that need to be optimized at the same time. This paper provides a review of the state-of-the-art in multi-objective evolutionary algorithms applied to power systems planning problems."
4,Multi-objective gene-pool optimal mixing evolutionary algorithm with the interleaved multi-start scheme,https://scholar.google.com//citations?view_op=view_citation&hl=vi&user=p3vHDZYAAAAJ&citation_for_view=p3vHDZYAAAAJ:3fE2CSJIrl8C,"Ngoc Hoang Luong, Han La Poutré, Peter AN Bosman",2018,"Swarm and Evolutionary Computation 40, 238-254, 2018",22,"The Multi-objective Gene-pool Optimal Mixing Evolutionary Algorithm (MO-GOMEA) has been shown to be a promising solver for multi-objective combinatorial optimization problems, obtaining an excellent scalability on both standard benchmarks and real-world applications. To attain optimal performance, MO-GOMEA requires its two parameters, namely the population size and the number of clusters, to be set properly with respect to the problem instance at hand, which is a non-trivial task for any EA practitioner. In this article, we present a new version of MO-GOMEA in combination with the so-called Interleaved Multi-start Scheme (IMS) for the multi-objective domain that eliminates the manual setting of these two parameters. The new MO-GOMEA is then evaluated on multiple benchmark problems in comparison with two well-known multi-objective evolutionary algorithms (MOEAs): Non-dominated Sorting Genetic …"
5,Elitist archiving for multi-objective evolutionary algorithms: To adapt or not to adapt,https://scholar.google.com//citations?view_op=view_citation&hl=vi&user=p3vHDZYAAAAJ&citation_for_view=p3vHDZYAAAAJ:IjCSPb-OGe4C,"Hoang N Luong, Peter AN Bosman",2012,"International Conference on Parallel Problem Solving from Nature, 72-81, 2012",22," Objective-space discretization is a popular method to control the elitist archive size for evolutionary multi-objective optimization and avoid problems with convergence. By setting the level of discretization, the proximity and diversity of the Pareto approximation set can be controlled. This paper proposes an adaptive archiving strategy which is developed from a rigid-grid discretization mechanism. The main advantage of this strategy is that the practitioner just decides the desirable target size for the elitist archive while all the maintenance details are automatically handled. We compare the adaptive and rigid archiving strategies on the basis of a performance indicator that measures front quality, success rate, and running time. Experimental results confirm the competitiveness of the adaptive method while showing its advantages in terms of transparency and ease of use."
6,Practice-oriented optimization of distribution network planning using metaheuristic algorithms,https://scholar.google.com//citations?view_op=view_citation&hl=vi&user=p3vHDZYAAAAJ&citation_for_view=p3vHDZYAAAAJ:YsMSGLbcyi4C,"Marinus OW Grond, Hoang N Luong, Johan Morren, Peter AN Bosman, Han JG Slootweg, Han La Poutré",2014,"2014 Power Systems Computation Conference, 1-8, 2014",20,"Distribution network operators require more advanced planning tools to deal with the challenges of future network planning. An appropriate planning and optimization tool can identify which option for network extension should be selected from available alternatives. However, many optimization approaches described in the literature are quite theoretical and do not yield results that are practically relevant and feasible. In this paper, a distribution network planning approach is proposed which meets requirements originating from network planning practice to guarantee realistic outcomes. This approach uses a state-of-the-art evolutionary algorithm: Gene-pool Optimal Mixing Evolutionary Algorithm. The performance of this algorithm, as well as the proposed model, is demonstrated using a real-world case study."
7,The multi-objective real-valued gene-pool optimal mixing evolutionary algorithm,https://scholar.google.com//citations?view_op=view_citation&hl=vi&user=p3vHDZYAAAAJ&citation_for_view=p3vHDZYAAAAJ:UebtZRa9Y70C,"Anton Bouter, Ngoc Hoang Luong, Cees Witteveen, Tanja Alderliesten, Peter AN Bosman",2017,"Proceedings of the Genetic and Evolutionary Computation Conference, 537-544, 2017",19,"The recently introduced Multi-Objective Gene-pool Optimal Mixing Evolutionary Algorithm (MO-GOMEA) exhibits excellent scalability in solving a wide range of challenging discrete multi-objective optimization problems. In this paper, we address scalability issues in solving multi-objective optimization problems with continuous variables by introducing the Multi-Objective Real-Valued GOMEA (MO-RV-GOMEA), which combines MO-GOMEA with aspects of the multi-objective estimation-of-distribution algorithm known as MAMaLGaM. MO-RV-GOMEA exploits linkage structure in optimization problems by performing distribution estimation, adaptation, and sampling as well as solution mixing based on an explicitly-defined linkage model. Such a linkage model can be defined a priori when some problem-specific knowledge is available, or it can be learned from the population. The scalability of MO-RV-GOMEA using …"
8,Entropy-based efficiency enhancement techniques for evolutionary algorithms,https://scholar.google.com//citations?view_op=view_citation&hl=vi&user=p3vHDZYAAAAJ&citation_for_view=p3vHDZYAAAAJ:u5HHmVD_uO8C,"Hoang Ngoc Luong, Hai Thi Thanh Nguyen, Chang Wook Ahn",2012,"Information Sciences 188, 100-120, 2012",19,"This paper introduces the notion of an entropy measurement for populations of candidate solutions in evolutionary algorithms, developing both conditional and joint entropy-based algorithms. We describe the inherent characteristics of the entropy measurement and how these affect the search process. Following these discussions, we develop a recognition mechanism through which promising candidate solutions can be identified without the need of invoking costly evaluation functions. This on-demand evaluation strategy (ODES) is able to perform decision making tasks regardless of whether the actual fitness evaluation is necessary or not, making it an ideal efficiency enhancement technique for accelerating the computational process of evolutionary algorithms.Two different evolutionary algorithms, a traditional genetic algorithm and a multivariate estimation of distribution algorithm, are employed as example …"
9,Evaluation of bi-objective treatment planning for high-dose-rate prostate brachytherapy—A retrospective observer study,https://scholar.google.com//citations?view_op=view_citation&hl=vi&user=p3vHDZYAAAAJ&citation_for_view=p3vHDZYAAAAJ:M3ejUd6NZC8C,"Stefanus C Maree, Ngoc Hoang Luong, Ernst S Kooreman, Niek van Wieringen, Arjan Bel, Karel A Hinnen, Henrike Westerveld, Bradley R Pieters, Peter AN Bosman, Tanja Alderliesten",2019,"Brachytherapy 18 (3), 396-403, 2019",18,"PurposeBi-objective treatment planning for high-dose-rate prostate brachytherapy is a novel treatment planning method with two separate objectives that represent target coverage and organ-at-risk sparing. In this study, we investigated the feasibility and plan quality of this method by means of a retrospective observer study.Methods and MaterialsCurrent planning sessions were recorded to configure a bi-objective optimization model and to assess its applicability to our clinical practice. Optimization software, GOMEA, was then used to automatically generate a large set of plans with different trade-offs in the two objectives for each of 18 patients treated with high-dose-rate prostate brachytherapy. From this set, five plans per patient were selected for comparison to the clinical plan in terms of satisfaction of planning criteria and in a retrospective observer study. Three brachytherapists were asked to evaluate the …"
10,Exploiting Linkage Information and Problem-Specific Knowledge in Evolutionary Distribution Network Expansion Planning,https://scholar.google.com//citations?view_op=view_citation&hl=vi&user=p3vHDZYAAAAJ&citation_for_view=p3vHDZYAAAAJ:_kc_bZDykSQC,"Ngoc Hoang Luong, Han La Poutré, Peter A.N. Bosman",2018,"Evolutionary Computation 26 (3), 471-505, 2018",16," This article tackles the Distribution Network Expansion Planning (DNEP) problem that has to be solved by distribution network operators to decide which, where, and/or when enhancements to electricity networks should be introduced to satisfy the future power demands. Because of many real-world details involved, the structure of the problem is not exploited easily using mathematical programming techniques, for which reason we consider solving this problem with evolutionary algorithms (EAs). We compare three types of EAs for optimizing expansion plans: the classic genetic algorithm (GA), the estimation-of-distribution algorithm (EDA), and the Gene-pool Optimal Mixing Evolutionary Algorithm (GOMEA). Not fully knowing the structure of the problem, we study the effect of linkage learning through the use of three linkage models: univariate, marginal product, and linkage tree. We furthermore experiment with …"
11,"Exploring trade-offs between target coverage, healthy tissue sparing, and the placement of catheters in HDR brachytherapy for prostate cancer using a novel multi-objective …",https://scholar.google.com//citations?view_op=view_citation&hl=vi&user=p3vHDZYAAAAJ&citation_for_view=p3vHDZYAAAAJ:Se3iqnhoufwC,"Krzysztof L Sadowski, Marjolein C van der Meer, Ngoc Hoang Luong, Tanja Alderliesten, Dirk Thierens, Rob van der Laarse, Yury Niatsetski, Arjan Bel, Peter AN Bosman",2017,"Proceedings of the Genetic and Evolutionary Computation Conference, 1224-1231, 2017",12,"Brachytherapy is a form of radiotherapy whereby a radiation source is guided near tumors, using devices such as catheter implants. In the present clinical workflow, catheters are first placed inside or close to the tumor based on clinical expertise. Subsequently, software is used to design a plan for the delivery of radiation. Treatment planning is essentially a multi-objective optimization problem, where conflicting objectives represent radiation delivered to tumor cells and healthy cells. However, current clinical software collapses this information into a single-objective, constrained optimization problem. Moreover, catheter positioning is typically not included. As a consequence, it is hard to obtain insight into the true nature of the trade-offs between key planning objectives and the placement of catheters. Such insights are however crucial in understanding how better treatment plans may be constructed. To obtain such …"
12,Scalable and practical multi-objective distribution network expansion planning,https://scholar.google.com//citations?view_op=view_citation&hl=vi&user=p3vHDZYAAAAJ&citation_for_view=p3vHDZYAAAAJ:WF5omc3nYNoC,"Ngoc Hoang Luong, Marinus OW Grond, Han La Poutré, Peter AN Bosman",2015,"2015 IEEE Power & Energy Society General Meeting, 1-5, 2015",11,"We formulate the distribution network expansion planning (DNEP) problem as a multi-objective optimization (MOO) problem with different objectives that distribution network operators (DNOs) would typically like to consider during decision making processes for expanding their networks. Objectives are investment cost, energy loss, total cost, and reliability in terms of the number of customer minutes lost per year. We consider two solvers: the widely-used Non-dominated Sorting Genetic Algorithm NSGA-II and the recently-developed Multiobjective Gene-pool Optimal Mixing Evolutionary Algorithm (MO-GOMEA). We also develop a scheme to get rid of the notoriously difficult-to-set population size parameter so that these solvers can more easily be used by non-specialists. Experiments are conducted on medium-voltage distribution networks constructed from real data. The results confirm that the MOGOMEA, with the …"
13,Medium-voltage distribution network expansion planning with gene-pool optimal mixing evolutionary algorithms,https://scholar.google.com//citations?view_op=view_citation&hl=vi&user=p3vHDZYAAAAJ&citation_for_view=p3vHDZYAAAAJ:W7OEmFMy1HYC,"Hoang N Luong, Marinus OW Grond, Peter AN Bosman, Han La Poutré",2013,"International Conference on Artificial Evolution (Evolution Artificielle …, 2013",10," Medium-voltage distribution network expansion planning involves finding the most economical adjustments of both the capacity and the topology of the network such that no operational constraints are violated and the expected loads, that the expansion is planned for, can be supplied. This paper tackles this important real-world problem using realistic yet computationally feasible models and, for the first time, using two instances of the recently proposed class of Gene-pool Optimal Mixing Evolutionary Algorithms (GOMEAs) that have previously been shown to be a highly efficient integration of local search and genetic recombination, but only on standard benchmark problems. One GOMEA instance that we use employs linkage learning and one instance assumes no dependencies among problem variables. We also conduct experiments with a widely used traditional Genetic Algorithm (GA). Our results show …"
14,Fine-tuning bert for sentiment analysis of vietnamese reviews,https://scholar.google.com//citations?view_op=view_citation&hl=vi&user=p3vHDZYAAAAJ&citation_for_view=p3vHDZYAAAAJ:L8Ckcad2t8MC,"Quoc Thai Nguyen, Thoai Linh Nguyen, Ngoc Hoang Luong, Quoc Hung Ngo",2020,"2020 7th NAFOSTED Conference on Information and Computer Science (NICS), 302-307, 2020",8,"Sentiment analysis is an important task in the field of Nature Language Processing (NLP), in which users' feedback data on a specific issue are evaluated and analyzed. Many deep learning models have been proposed to tackle this task, including the recently-introduced Bidirectional Encoder Representations from Transformers (BERT) model. In this paper, we experiment with two BERT fine-tuning methods for the sentiment analysis task on datasets of Vietnamese reviews: 1) a method that uses only the [CLS] token as the input for an attached feed-forward neural network, and 2) another method in which all BERT output vectors are used as the input for classification. Experimental results on two datasets show that models using BERT slightly outperform other models using GloVe and FastText. Also, regarding the datasets employed in this study, our proposed BERT fine-tuning method produces a model with better …"
15,"Efficient, effective, and insightful tackling of the high-dose-rate brachytherapy treatment planning problem for prostate cancer using evolutionary multi-objective optimization …",https://scholar.google.com//citations?view_op=view_citation&hl=vi&user=p3vHDZYAAAAJ&citation_for_view=p3vHDZYAAAAJ:5nxA0vEk-isC,"Ngoc Hoang Luong, Anton Bouter, Marjolein C Van Der Meer, Yury Niatsetski, Cees Witteveen, Arjan Bel, Tanja Alderliesten, Peter AN Bosman",2017,"Proceedings of the Genetic and Evolutionary Computation Conference Companion …, 2017",7,"We address the problem of high-dose-rate brachytherapy treatment planning for prostate cancer. The problem involves determining a treatment plan consisting of the so-called dwell times that a radiation source resides at different positions inside the patient such that the prostate volume and the seminal vesicles are covered by the prescribed radiation dose level as much as possible while the organs at risk, eg, bladder, rectum, and urethra, are irradiated as little as possible. The problem is highly constrained, following clinical requirements for radiation dose distribution while the planning process for treatment planners to design a clinically-acceptable treatment plan is strictly time-limited. In this paper, we propose that the problem can be formulated as a bi-objective optimization problem that intuitively describes trade-offs between target volumes to be radiated and organs to be spared. We solve this problem with the …"
16,Fast and insightful bi-objective optimization for prostate cancer treatment planning with high-dose-rate brachytherapy,https://scholar.google.com//citations?view_op=view_citation&hl=vi&user=p3vHDZYAAAAJ&citation_for_view=p3vHDZYAAAAJ:aqlVkmm33-oC,"Ngoc Hoang Luong, Tanja Alderliesten, Bradley R Pieters, Arjan Bel, Yury Niatsetski, Peter AN Bosman",2019,"Applied Soft Computing 84, 105681, 2019",6,"Purpose:Prostate high-dose-rate brachytherapy (HDR-BT) planning involves determining the movement that a high-strength radiation stepping source travels through the patient’s body, such that the resulting radiation dose distribution sufficiently covers tumor volumes and safely spares nearby healthy organs from radiation risks. The Multi-Objective Real-Valued Gene-pool Optimal Mixing Evolutionary Algorithm (MO-RV-GOMEA) has been shown to be able to effectively handle this inherent bi-objective nature of HDR-BT planning. However, in clinical practice there is a very restricted planning time budget (often less than 1 h) for HDR-BT planning, and a considerable amount of running time needs to be spent before MO-RV-GOMEA finds a good trade-off front of treatment plans (about20–30 min on a single CPU core) with sufficiently accurate dose calculations, limiting the applicability of the approach in the clinic. To …"
17,Heuristics in permutation gomea for solving the permutation flowshop scheduling problem,https://scholar.google.com//citations?view_op=view_citation&hl=vi&user=p3vHDZYAAAAJ&citation_for_view=p3vHDZYAAAAJ:ULOm3_A8WrAC,"GH Aalvanger, Ngoc Hoang Luong, Peter AN Bosman, Dirk Thierens",2018,"International Conference on Parallel Problem Solving from Nature, 146-157, 2018",6," The recently introduced permutation Gene-pool Optimal Mixing Evolutionary Algorithm (GOMEA) has shown to be an effective Model Based Evolutionary Algorithm (MBEA) for permutation problems. So far, permutation GOMEA has only been used in the context of Black-Box Optimization (BBO). This paper first shows that permutation GOMEA can be improved by incorporating a constructive heuristic to seed the initial population. Secondly, the paper shows that hybridizing with job swapping neighborhood search does not lead to consistent improvement. The seeded permutation GOMEA is compared to a state-of-the-art algorithm (VNS4) for solving the Permutation Flowshop Scheduling Problem (PFSP). Both unstructured and structured instances are used in the benchmarks. The results show that permutation GOMEA often outperforms the VNS4 algorithm for the PFSP with the total flowtime criterion."
18,Entropy-based substructural local search for the Bayesian optimization algorithm,https://scholar.google.com//citations?view_op=view_citation&hl=vi&user=p3vHDZYAAAAJ&citation_for_view=p3vHDZYAAAAJ:d1gkVwhDpl0C,"Hoang N Luong, Hai TT Nguyen, Chang Wook Ahn",2010,"Proceedings of the 12th annual conference on Genetic and evolutionary …, 2010",3,"A customary paradigm of designing a competent optimization algorithm is to combine an effective global searcher with an efficient local searcher. This paper presents and analyzes an entropy-based substructural local search method (eSLS) for the Bayesian Optimization Algorithm (BOA). The local searcher (the mutation operator) explores the substructural neighborhood areas defined by the probabilistic model encoded in the Bayesian network. The improvement of each local search step can be estimated by considering the variation this mutation causes to the entropy measurement of the population. Experiments show that incorporating BOA with eSLS results in a substantial reduction in the number of costly fitness evaluations until convergence. Moreover, this paper provides original insights into how the randomness of populations can be exploited to enhance the performance of optimization processes."
